<?xml version='1.0' encoding="UTF-8"?>
<regions xmlns:xsi="http://www.w3.org/2001/XMLSchema-instance"
         xsi:noNamespaceSchemaLocation="regions.xsd">
  <region>
    <region_id>1</region_id>
    <region_name>Europe</region_name>
  </region>
  <region>
    <region_id>2</region_id>
    <region_name>Americas</region_name>
  </region>
  <region>
    <region_id>3</region_id>
    <region_name>Asia</region_name>
  </region>
  <region>
    <region_id>4</region_id>
    <region_name>Middle East and Africa</region_name>
  </region>
</regions>
